13:24:32.192571 IP 192.51.100.15.54321 > 203.0.113.2.53: 35084+ [1au] A? yummyrecipesforme.com. (32)
13:24:32.192573 IP 203.0.113.2 > 192.51.100.15: ICMP 203.0.113.2 udp port 53 unreachable, length 92
13:24:33.192571 IP 192.51.100.15.54321 > 203.0.113.2.53: 35084+ [1au] A? yummyrecipesforme.com. (32)
13:24:33.192575 IP 203.0.113.2 > 192.51.100.15: ICMP 203.0.113.2 udp port 53 unreachable, length 92
13:24:34.192571 IP 192.51.100.15.54321 > 203.0.113.2.53: 35084+ [1au] A? yummyrecipesforme.com. (32)
13:24:34.192578 IP 203.0.113.2 > 192.51.100.15: ICMP 203.0.113.2 udp port 53 unreachable, length 92
